title,link,content
"b'Former U.S. Army Sniper, 2 Other Soldiers Accused of Becoming International Hitmen'",https://www.yahoo.com/news/former-u-army-sniper-2-144836866.html,"(NEW YORK) — A former U.S. Army sniper and two other ex-American soldiers agreed to become contract killers for an international crime boss who wanted to settle a score with a real estate agent in the Philippines he thought had cheated him on a land deal, a prosecutor said Tuesday in opening statements at the trial of the three men.Joseph Hunter, a onetime sergeant with a Special Forces background, Adam Samia and Carl David Stillwell have denied they planned the 2012 execution-style hit — a case that’s provided an inside glimpse into the secret fraternity of private mercenaries willing to kill in cold blood for cash.Prosecutors said the 52-year-old Hunter was working as a security chief for weapons and drug trafficker Paul Le Roux when he recruited Samia and Stillwell to travel from their homes in Roxboro, North Carolina, to the Philippines for what was called “ninja work.” Hunter provided firearms and silencers and told them Le Roux would pay them $35,000 a piece to get the job done, Assistant U.S. Attorney Patrick Egan said in federal court in Manhattan.The broker, Catherine Lee, was on a “kill list” that self-styled assassins with military backgrounds saw as a golden opportunity, Egan said.“If Paul Le Roux wanted somebody killed, these guys got the call,” he said. “For these men, more murders meant more money.”Samia, 43, and Stillwell, 50, did surveillance on Lee before contacting her pretending to be potential clients, the prosecutor said. While returning from a trip to the countryside outside of Manila, Samia pulled out a .22-caliber gun and killed Lee by shooting her twice in the face as she sat in the back seat of a van, he said.Lee’s body was found on a pile of garbage on the side of the road, Egan said. After being paid, her killers were ordered back to the United States, where they were arrested in 2015.An investigation turned up a picture on Stillwell’s phone of a bloody head wrapped in a towel that was taken around the time of Lee’s death, authorities said. He also admitted being behind the wheel of the van when she was shot, they added.Prosecutors said other evidence includes a secretly recorded video of Hunter from a sting in Thailand that resulted in a separate conviction for plotting to kill a Drug Enforcement Administration agent. They said he’s overheard talking about killing people for Le Roux, including a Filipino real-estate agent.On Tuesday, defense attorneys asked jurors to keep an open mind, saying the case lacked eyewitness, forensic and other conclusive evidence needed to convict. They also told them not to trust shady government witnesses like Le Roux, who has pleaded guilty and is cooperating.Hunter’s attorney, Cesar De Castro, suggested the government couldn’t prove its case.Samia only agreed “to do legitimate, legal security work,” said his lawyer, Jeremy Schneider. Stillman’s lawyer, Robert Ray, didn’t deny his client’s statements about being in the van but claimed he never joined a murder conspiracy.“It just didn’t happen,” Ray said."
b'Afghan Air Force in the spotlight after madrassa bombing',https://www.yahoo.com/news/afghan-air-force-spotlight-madrassa-bombing-133618310.html,"Kabul (AFP) - A deadly airstrike on a religious school in Afghanistan has turned the spotlight on the country's fledgling air force, which is increasingly taking on combat missions to pressure insurgents.Dozens of children were killed or wounded when Afghan Air Force (AAF) helicopters attacked the madrassa in the northeastern province of Kunduz, Afghan security sources told AFP. The defence ministry has distanced the AAF from the civilian casualties, but the United Nations has launched an investigation.AFP explains Afghanistan's air capability, its previous mishaps and who is training them.- Who flies the planes? -Afghanistan's air force was decimated by the civil war of the 1990s and the turbulent period of Taliban rule that ended in 2001.Western forces began rebuilding it in 2007 but it has been a slow process.NATO's Resolute Support mission in Afghanistan has been training pilots and ground controllers across the country as part of a modernisation of the AAF.Getting selected is not easy. Each recruit is subject to intensive background checks by Afghan intelligence, and must also be sponsored by two officers to attest they have no links to the enemy.- What aircraft do they have? -Precise figures on the size of Afghanistan's fleet and the number of pilots are not available.But US Forces' officials told AFP in February that it includes four C-130 transport aircraft, 24 C-208 supply planes, 24 Russian Mi-17 helicopters that will be replaced by 159 UH-60 Black Hawks, 12 A-29 Super Tacano attack planes, and 25 MD-530 attack helicopters.At the same time, the US -- the only foreign force known to be carrying out airstrikes in the country -- is deploying more aircraft to Afghanistan, which has become the main theatre of operations for the US Air Force following a drawdown in Syria and Iraq.- When did they start bombing? -AAF airstrikes are relatively recent -- the airforce only dropped its first bomb about a year ago, though its ability to support ground troops and carry out surveillance is growing.It has accelerated bombardments in recent months as the Americans beef up the country's aerial capability with more aircraft and better weapons.Last month, the AAF dropped its first laser-guided bomb on a Taliban compound in the western province of Farah, where the militants have gone on the offensive.The US has also ramped up airstrikes as part of US President Donald Trump's new strategy for Afghanistan that has given American forces more leeway to go after the Taliban and other militant groups.- How accurate are they? -Without access to full figures on Afghan airstrikes it is difficult to say with any certainty, but mistakes are being made.In 2017, the United Nations noted in its annual report on civilian casualties that more Afghans were being killed in airstrikes -- a rise of seven percent over the previous year, the highest number of casualties since the UN began recording such figures in 2009.Of the total 295 deaths and 336 injured documented by the UN in aerial operations, the AAF was responsible for 99 deaths and 210 injured.In October an ""erroneous"" Afghan airstrike killed 10 security forces in volatile Helmand province; while in August the country's air force killed up to 13 civilians in airstrikes targeting a Taliban base in the western province of Herat."
b'Mother allegedly used stun gun to wake son for Easter service',https://www.yahoo.com/news/mother-allegedly-used-stun-gun-095047109.html,Police in Phoenix arrested a mother for child abuse after they say she used a stun gun to wake him up for church.
"b'Architectural Digest, Bon Appetit &#38; Le Coucou Celebrate the Arrival of Liebherr&#39;s Monolith'",https://www.yahoo.com/news/architectural-digest-bon-appetit-le-193542461.html,"On Thursday, March 15, AD and Bon Appétit partnered with Liebherr to celebrate the U.S. launch of the Monolith in The Gallery at One World Trade Center. Bon Appétit 2017 Best New Restaurant Le Coucou prepared a custom menu of canapés to highlight the BioFresh design features and special technology that are the hallmarks of the Monolith."
b'Jenna Dewan Tatum Hinted At Marital Trouble With Channing Tatum Months Ago',https://www.yahoo.com/news/jenna-dewan-tatum-hinted-marital-163307361.html,"Channing Tatum and Jenna Dewan Tatum’s announcement that they were splitting after nearly nine years of marriage left fans everywhere feeling blindsided. But looking back, there may have been hints of marital trouble over the past few months. In an interview with Health magazine in February, Dewan Tatum revealed their marriage wasn’t perfect.“When people say you guys have such a perfect life, I want to scream and tell them no one’s perfect,” she said. “I think there are such things as great fits. It is a great fit as long as you are growing together, and I think up until this point we’ve really grown together. Even if one starts to grow, the other catches up and vice versa.” She added: “We’ve always had the same values. But we’re not perfect! Are you kidding? We fight like other couples, we disagree about things, we have days where we don’t really like each other.Someoutlets also pointed out that Dewan Tatum stepped out without Tatum at the Vanity Fair Oscars after party, and instead brought along her girlfriend, actress Emmanuelle Chriqui. Dewan Tatum insisted that Channing was “so happy to have a night off.”People pointed out that the couple, who generally gush over each other on social media, have been relatively mum the past few months. Instead, Dewan Tatum posted what some now see as “cryptic Instagrams:”After meeting on the set of “Step Up” in 2006, the two married in Malibu, California, in 2009 and welcomed their only child, Everly, in 2013.The couple said they remain devoted to their 4-year-old in a statement they released about their split on Monday. “We have lovingly chosen to separate as a couple. We fell deeply in love so many years ago and have had a magical journey together,” the statement said.“Absolutely nothing has changed about how much we love one another, but love is a beautiful adventure that is taking us on different paths for now,” it continued. “There are no secrets nor salacious events at the root of our decision — just two best-friends realizing it’s time to take some space and help each other live the most joyous, fulfilled lives as possible.”Related Video: "
b'Russia&apos;s Dangerous S-400 Air Defense System is Headed to China (And Maybe Turkey)',https://www.yahoo.com/news/russia-apos-dangerous-400-air-234400646.html,"Dave MajumdarSecurity, Russia's Dangerous S-400 Air Defense System is Headed to China (And Maybe Turkey)Russia has delivered to China its first regiment of S-400 surface-to-air missile batteries. Moscow signed a deal with Beijing to sell China the potent weapon system in 2014.""Two vessels have delivered the first regimental set of S-400s from the port of Ust-Lug, Leningrad Region, to China within the time limit established by the contract. It includes a command post, radar stations, launching stations, energy equipment and other property. It lacks the equipment that was onboard the third vessel,"" a Russian defense source told the TASS news agency. ""The work continues, and the missing equipment is expected to be delivered to the customer in the summer.""Recommended: We Went Aboard the Most Powerful Aircraft Carrier Ever Built.Recommended: This Is How China Would Invade Taiwan (And How to Stop It).Recommended: The Story of the F-52 Fighter.A third vessel carrying additional hardware was caught in a storm enroute from Russia and had to turn back. It appears that the weapon system will not operable until the missing hardware is delivered.Meanwhile, Russia is pressing ahead to deliver the S-400 to Turkey by 2020. Ankara seems to be pressing ahead to buy the Russian-made weapons despite strong opposition from its NATO ally, the United States.""A priority task in the sphere of military technical cooperation is the implementation of the contract for supplies of S-400 Triumf missile systems to Turkey,"" Russian president Vladimir Putin said during of the Russia-Turkey Cooperation Council according to TASS. ""We hope that the sectoral intergovernmental commission will look into the prospects for further supplies of Russian-made military hardware to Turkey at its next meeting.”Russian presidential aide Yuri Ushakov told TASS that Moscow would do everything possible to deliver the S-400 to Turkey—which has already made a down payment—by 2020. ""Turkey did raise this issue. As far as I know, steps will be taken to meet Turkey’s wish,"" Ushakov said.Turkey, for its part, is determined to buy the S-400 despite the threat of sanctions by the United States.“The U.S. understands Turkey’s desire to improve its air defenses,” a Trump administration official told the Hürriyet Daily News. “But we are concerned and have said so publicly about potential acquisition of Russian S-400 missiles, which would have implications for NATO interoperability and which would potentially expose Turkey to sanctions due to the new sanctions law recently passed by Congress.”Turkey points out that NATO allies did not pressure Greece to drop its S-300 purchase in previous year, though that deal came under during a much less antagonistic period in the West’s relations with Russia.“You’ve said nothing to Greece but you said that you will not let Turkey acquire S-400,” Turkish president Recep Tayyip Erdogan said according to the Moscow-based TASS news agency. “You claimed that the contact with Russia was a mistake. You also said that you might introduce sanctions. We are not going to be accountable to you. We will proceed along the right way without any concessions for the sake of achieving our own goals.”As with many other nations, the Turks are concerned by the U.S. Congress’ infringement on their sovereignty. More often than not, Congress passes laws where the lawmakers—who often maintain a well-educated but very inexperienced staff—fail to consider the second and third order consequences of their actions.  Dave Majumdar is the defense editor for The National Interest. You can follow him on Twitter: @davemajumdar.Image: Creative Commons. Read full article"
b'Twitter CEO Jack Dorsey Calls Out Trump Over &apos;Thoughts And Prayers&apos; Tweet Following Shooting',https://www.yahoo.com/news/twitter-ceo-jack-dorsey-calls-053836851.html,"President Donald Trump tweeted his “thoughts and prayers” following Tuesday’s shooting at YouTube’s headquarters. However, many people responded by urging the president to take policy action. Chief among them was Jack Dorsey, co-founder and CEO of Twitter: We can’t keep being reactive to this, thinking and praying it won’t happen again at our schools, jobs, or our community spots. It’s beyond time to evolve our policies. This is a simple and reasonable approach, and it won’t solve all, but it’s a good start: https://t.co/ADYalbaO57https://t.co/nbXpH9DDyTFour people were injured in the attack at YouTube’s San Bruno, California headquarters. The shooter, identified in local media as Nasim Aghdam, died at the scene of a self-inflicted gunshot wound.Dorsey said policy action won’t “solve all,” but linked to five proposals from March For Our Lives to help cut down on gun violence.Related: New Details on Alleged YouTube ShooterFor more news videos visit Yahoo View. "
b'Marco Rubio on gun control: It depends who he&#39;s talking to',https://www.yahoo.com/news/dc-officials-cite-gun-control-hypocrisy-condemning-rubio-041839636.html,"WASHINGTON (AP) — It was one week after the fatal shootings at a Parkland, Florida, high school, and Republican Sen. Marco Rubio was looking to show solidarity with an angry crowd of parents and students in his home state. He told them — and a national television audience — that 18-year-olds should not be able to buy a rifle and said, ""I will support a law that takes that right away.""About 1,000 miles (1,600 kilometers) north, District of Columbia officials could only shake their heads in disbelief. The city already had a law barring 18-year-olds from buying rifles, yet Rubio was the main senator pushing legislation to end that ban, as well as D.C.'s prohibition of assault weapons.""Rubio's gun bill should be a public embarrassment as well as a personal embarrassment to him,"" said Eleanor Holmes Norton, Washington's nonvoting delegate in Congress.Gun control has long been a sore point in relations between officials in this heavily Democratic city, home to some of the nation's toughest gun control laws, and Republicans, who as the congressional majority have power over D.C.'s laws. The strong feelings have intensified with the nation at a crossroads moment in the gun control debate after the Feb. 14 shootings at Marjory Stoneman Douglas High School and a subsequent ""March for Our Lives"" gun-control rally in Washington.Rubio, in particular, is seen as the villain. City officials accuse him of playing cynical political games with the lives of Washington residents to curry favor with the National Rifle Association.Following the town hall, Washington Mayor Muriel Bowser challenged Rubio to withdraw his bill. Rubio sent her a letter saying that he and Bowser ""share a common goal"" and that his bill seeks only to bring Washington ""in line with federal law."" If federal law changes —which Rubio said is his goal — then Washington's laws would change as well.Bowser, a Democrat, posted the letter on Twitter with her handwritten notes and objections written in the margins. Those notes include Bowser calling Rubio's stance ""the epitome of hypocrisy.""""He's just using it to boost his NRA score,"" Bowser said in an interview with The Associated Press. ""What we think Marco Rubio should be focused on is his job.""Asked for comment by The Associated Press, Rubio staffers responded by providing the Rubio letter that Bowser had posted.Rubio introduced the bill, known as the Second Amendment Enforcement Act, in 2015 and again in 2017. According to the NRA website, Rubio has an A-plus rating. Among its list of Rubio accomplishments is that he ""sponsored legislation that would repeal Washington, D.C.'s draconian gun control laws and restore the right of self-defense to law-abiding individuals in our nation's capital.""Norton said she's been fighting off similar bills in Congress for years. Another one, sponsored by Virginia Republican Tom Garrett, exists in the House. Neither of them has much chance of passing because the Republican majorities in Congress wouldn't hold together on such a divisive issue, she said.""The worst part is why he did it. Why would a senator from Florida take on this issue?"" Norton asked. ""He's coming back every year for his NRA payoff.""According to public records, Rubio received just under $10,000 directly from the NRA during the 2016 election. However the nonpartisan Center for Responsive Politics, which combines direct contributions from the NRA with contributions from like-minded affiliates, super PACs and money spent on campaign ads on behalf of the candidate, estimates that Rubio has received more than $3.3 million over the course of his career, making him the 6th-highest recipient in Congress.The Washington government has bristled for years under what officials call the heavy-handed and arrogant oversight of Congress, which has the right to alter or spike all Washington laws.Washington has long fought to defend its strict gun control. A 2008 Supreme Court ruling declared Washington's blanket ban on handgun ownership unconstitutional. Washington restrictions such as preventing gun owners from registering more than one gun per month and requiring re-registration every three years also have been struck down by the courts.The issues of Washington's autonomy and its gun control laws are deeply intertwined. The closest Washington has come in recent years to having a vote in Congress unraveled over gun control.Republicans have opposed statehood for the District of Columbia, which would boost Democratic power in Congress. Despite the Republican Party's general opposition to federal interference in state issues, the official GOP platform stance on D.C. statehood is that it can only be achieved via constitutional amendment. The platform states that ""the nation's capital city is a special responsibility of the federal government because it belongs both to its residents and to all Americans.""A 2009 compromise proposed creating a new congressional district in heavily Republican Utah. In exchange, Washington's House delegate seat would be upgraded to full voting status.However, as the D.C. Voting Rights Act worked its way through Congress, Republican Nevada Sen. John Ensign attached a rider that would have required Washington to abolish most of its gun-ownership restrictions. The city government concluded it was too high a price to pay and the bill was shelved."
"b'In rare comment, PetroVietnam says South China Sea tension to hurt offshore operations'",https://www.yahoo.com/news/rare-petrovietnam-says-south-china-sea-tension-hurt-070626469--finance.html,"By Khanh VuHANOI (Reuters) - Tension in the South China Sea will hurt PetroVietnam's offshore exploration and exploitation activities this year, the state-run oil and gas group said on Tuesday, weeks after the Southeast Asian nation suspended a project under pressure from China.Vietnam and China have been embroiled in maritime disputes in parts of the busy waterway, where China claims 90 percent of the potentially energy-rich maritime territory, which Vietnam calls the East Sea.""The East Sea is forecast to continue to have uncertainty this year ... affecting the company's efforts to attract foreign investors to invest in its open offshore fields"", PetroVietnam said on its website.PetroVietnam has rarely openly admitted that the tension has had an adverse impact on its offshore exploration and production fields, especially those located near the U-shaped ""nine-dash line"" that marks the vast area claimed by China.During a trip to Hanoi on Sunday, Chinese Foreign Minister Wang Yi said both nations should settle their disputes in the South China Sea through talks and move to jointly use its waters.The two countries had agreed such a move was ""extremely important for the healthy and sustainable development of bilateral relations,"" Wang said.In its statement, PetroVietnam said the dispute with China would add to its struggle to maintain crude oil output amid already declining production from Vietnam's key fields.Last month, it ordered Spanish energy firm Repsol to suspend its ""Red Emperor"" project off Vietnam's southeastern coast following pressure from China, sources told Reuters.The $1-billion ""Red Emperor"" field is of moderate size by international standards but was seen as a key asset to help slow the decline of Vietnam's stalling oil and gas production.But the block lies near China's ""nine-dash line"" and overlaps what it says are its own oil concessions.Vietnam's crude oil output this year is expected to fall 14.7 percent from last year to 11.31 million metric tonnes, or 227,130 barrels per day, the government has said.(Reporting by Khanh Vu; Editing by James Pearson and Clarence Fernandez)"
b'1 Elephant Died and 4 Others Were Hurt After a Circus Truck Crash',https://www.yahoo.com/news/1-elephant-died-4-others-142345297.html,"(MADRID) — An elephant died and four more are being treated for injuries after a circus truck accident on a major Spanish highway that provoked an outcry among animal rights defenders.The truck overturned on Monday on the highway linking Albacete with Murcia, in the south of the country, after overtaking another long vehicle, said Albacete’s Civil Guard spokesman Jose Amado.He said the initial investigation has found that the movement of the five female elephants inside the truck could have destabilized it when the driver maneuvered to switch lanes.The driver wasn’t injured, the spokesman said, but one of the elephants died on the spot.The four surviving elephants are being treated by veterinarians in a public facility before being moved to a clinic in coming days, Amado said. Three of them have minor cuts and one has more serious injuries to her legs.“With five unpredictable animals, each one of them weighing three to four tons, accidents can happen no matter how much care has been taken,” he said.Photos and videos shared by local police and authorities showed the elephants standing on the road and being lifted onto trucks by huge industrial cranes.A section of the highway near Pozo Canada, south of Albacete, remained closed for nearly three hours until the carcass of the dead elephant was also removed, local authorities said.Animal rights groups said the accident is the latest example of how the nature of the circus business is a danger to the physical and behavioral needs of wild animals.“These incredible animals are being carted around the country, confined and forced to perform,” said Animal Defenders International President Jan Creamer in an emailed statement, adding that animals are often “confined in small spaces, deprived of physical and social needs, spending excessive amounts of time shut in transporters.”The Association of United Circuses said the overturned truck had been cleared by authorities for the transportation of animals and the journey had been approved by veterinarians.“Animal rights activists have turned this accident into a scandal,” said the association’s spokesman, Ignacio Pedrera. “They have used it to make politics and attack this industry when road accidents, whether involving animals or not, happen all the time.”Pedrera said 13 out of the 22 active circuses touring Spain use animals in performances. The industry employs more than 2,500 families, he added."
