title,link,content
"b'Nvidia is a buy according to Bank of America, Apple reportedly dives deeper into augmented reality, Facebook responds to video bug'",https://www.yahoo.com/news/nvidia-buy-according-bank-america-apple-reportedly-dives-deeper-augmented-reality-facebook-responds-video-bug-150035609.html,"Here’s a look at some of the companies the Yahoo Finance team will be watching for you.Nvidia (NVDA) tops our list. Bank of America (BAC) named the tech giant a top pick and reiterated its buy rating despite the stock’s recent decline. The firm cited product leadership in several large growth categories including virtual reality, for its call. The stock is up 104% in the past 12 months compared to the S&P’s 9.5% gain.Apple (AAPL) is diving deeper into augmented reality. Digitimes reports Apple is again working on microLED displays for an AR wearable and future Apple Watches. Currently, watches use OLED displays, but microLEDs can be brighter, more energy efficient, and thinner. Digitimes estimates production will begin at the end of the year but other sources say 2020 is a more reasonable benchmark.Facebook (FB) can’t catch a break. The site has been archiving videos that users thought they had deleted. Facebook says a bug prevented the videos from being automatically deleted and is now deleting the videos. Users found this issue after downloading their data archives in the wake of Facebook’s massive data scandal.CBS (CBS) wants in on MTV. The broadcaster is reportedly making a below market offer to remerge with MTV’s parent Viacom (VIA). More than 12 years ago, CBS and Viacom were one company and controlled by the family of billionaire Sumner Redstone. An offer is expected to be made this week."
b'17 States Sue Trump Administration Over Census Citizenship Question',https://www.yahoo.com/news/18-states-sue-trump-administration-160424692.html,"New York Attorney General Eric Schneiderman (D) filed a federal lawsuit on Tuesday aimed at blocking the Trump administration from adding a question about citizenship to the 2020 census, saying such a question violates the U.S. Constitution’s mandate to count all persons.In a statement, Schneiderman’s office said the suit was filed on behalf of 17 states plus the District of Columbia, six cities and the U.S. Conference of Mayors. It comes a little over a week after the Commerce Department, which oversees the Census Bureau, announced it would add the question. Schneiderman said the decision to add a citizenship question “blatantly” undermined the Constitution’s mandate to count all people.“The prospect of someone saying, ‘I am from the Trump administration’ knocking on your door to ask a question about citizenship would understandably provoke real fear,” Schneiderman said during a Tuesday press conference, flanked by members of New York’s congressional delegation.The numbers from the census are used to determine how many seats each state gets in Congress, as well as how hundreds of billions of dollars in federal funds are allocated. Democratic members of New York’s congressional delegation said Tuesday that the decision to add a citizenship question was an attack on states, like New York, with high immigrant populations in an attempt to cut their congressional representation and share of federal funding.“It is being added to harm states and cities like New York both politically and financially,” said Rep. Carolyn Maloney (D-N.Y.). “We are being unfairly targeted because we have large, diverse immigrant populations which we welcome and support.”Civil rights groups voiced loud opposition to adding the question, noting that the bureau has not tested the question and that immigrant groups will be afraid to respond out of fear about their immigration status. In September, census researchers reported they were already seeing an unprecedented amount of concern about the confidentiality of census responses amid the Trump administration’s harsh immigration rhetoric and policies.The census already asks Americans about their citizenship as part of the American Community Survey, a smaller annual survey that goes out to about 3 million people. The Department of Justice asked the Commerce Department to add a citizenship question to the 2020 census, saying it needed better information to better enforce Section 2 the Voting Rights Act, the landmark 1965 law designed to protect the voting power of minorities. Section 2 prohibits discriminatory voting practices. The census has not asked about citizenship on the decennial form since 1950, and former top Justice Department officials say that the ACS provides adequate data to enforce the law.On Tuesday, Schneiderman questioned whether U.S. Attorney General Jeff Sessions was really interested in better enforcing the Voting Rights Act.“Jeff Sessions has not brought one case under Section 2 of the Voting Rights Act since he’s been Attorney General,” he said.A Commerce Department spokesman expressed confidence that the decision to add the citizenship question would withstand legal scrutiny.“We are not going to comment on the specifics of pending litigation, but these cases are without merit. We look forward to prevailing in court and continuing to work with the Census Bureau to conduct a complete and accurate 2020 census,” the spokesman said.This post has been updated."
b'Kaley Cuoco Explains Why Her Ex-Husband &apos;Ruined&apos; Marriage For Her',https://www.yahoo.com/news/kaley-cuoco-explains-why-her-151542575.html,"Kaley Cuoco is calling out her ex-husband, former professional tennis player Ryan Sweeting, for nearly ruining marriage for her.“I honestly thought I wouldn’t get married again,” the “Big Bang Theory” star says in the May issue of Cosmopolitan. “My ex ruined that word for me. I married someone the first time who completely changed.”“The person I ended up with was not the person I originally met,” she went on. “And that wasn’t my fault ― that was his. I knew how much I had to give and how much I wanted to receive.”Cuoco and Sweeting met in 2013. The two got engaged in September of that year, just three months after they were first spotted together. They married a few months later in a whirlwind ceremony on New Year’s Eve.However, after 21 months of marriage, Cuoco filed for divorce in 2015. The 32-year-old confessed the two just weren’t a match shortly after the split.“I knew even deep down, I know this is just not the right thing. The right thing is coming for me, I knew it, I knew it, I knew it,” she said during an appearance on “The Talk” in 2016.“I think even when I went through my big breakup, even my friends that know me so well, I might have said things like, ‘I’m never going to love again. I’m never going to get married again,’” she said at the time. “But the people that know you best, they know my heart and that’s just not me.”Sweeting himself has said little publicly about the divorce.After splitting from Sweeting, Cuoco began dating professional equestrian Karl Cook in April 2016. The two got engaged this past November. The “Big Bang Theory” star told Cosmo she can’t wait to marry her new fiancé. “I knew I just had to be patient,” she told the magazine. “I had to go through a lot of things, but it brought me to Karl.” Head to Cosmopolitan to read the rest of Cuoco’s interview or look for it on newsstands April 10. Video: Kaley Cuoco Recreates Penny's Most Iconic Scenes From 'The Big Bang Theory'This article originally appeared on HuffPost."
b'Crash Tests Show Some Small-SUV Passengers Less Safe than Drivers',https://www.yahoo.com/news/crash-tests-show-small-suv-passengers-less-safe-040102342.html,"Consumer Reports has no financial relationship with advertisers on this site.Consumer Reports has no financial relationship with advertisers on this site.New crash test results show that some popular vehicles still don’t offer adequate protection for passengers even if they can keep drivers safe in certain types of crashes.On Wednesday, the Insurance Institute for Highway Safety (IIHS) released passenger-side small overlap test scores for seven small SUVs. The 40 mph test mimics a crash where the front corner of the vehicle collides with a tree, telephone pole, or the front corner of another vehicle.The Ford Escape earned the lowest possible rating of “Poor” for a passenger-side impact, which translates to a “very high likelihood of the passenger having a thigh or hip injury,” according to IIHS. The Mitsubishi Outlander Sport earned a Marginal rating for the passenger. However, both vehicles earned “Acceptable” scores for crash tests on the driver’s side.IIHS says this is because some vehicles were designed only to pass the group’s driver-side small overlap tests. For instance, Ford reinforced the structure of the driver’s side on the Escape starting in 2017, but did not make the same changes on the passenger side. “They already have the know-how for what to do to improve structure,” said Becky Muller, lead engineer for IIHS’ small overlap tests. “To apply the same kinds of designs to the passenger side would be the simplest and most effective fix.”The results echo those found in prior tests, where the current Subaru Forester and Toyota RAV4 both scored better on driver-side tests than on passenger-side tests. Both of those vehicles will be redesigned for 2019. A spokesman from Toyota told CR, ""The 2019 RAV4 that we revealed at last week’s New York International Auto Show is on our new TNGA platform, and we’ve incorporated countermeasures to meet or exceed tests.""Mueller said that most automakers are reacting to the new test by making safety improvements when a model is scheduled to be refreshed or redesigned. “Since we announced the official rating test, we’ve seen a dramatic increase in the number of 'Good' rated vehicles that we’re testing on the passenger side,” she said.""These results also demonstrate the value of third-party testing,"" said Jen Stockburger, director of operations at CR's auto test center. ""Ratings are not only a useful tool for consumers, but can drive industry to make important improvements.""According to IIHS, side-curtain airbags did not deploy during tests of both the Outlander Sport and the Escape, which may have been a factor in both vehicles’ scores.“If these vehicles aren’t designed specifically with the passenger small overlap test in mind, the restraint systems may not be tuned to deploy when they need to in a crash,” Mueller said. The BMW X1, Chevrolet Equinox, GMC Terrain, Jeep Compass, and Mitsubishi Outlander joined the previously tested Hyundai Tucson, Honda CR-V, Kia Sportage, and Mazda CX-5 and CX-3 to earn top “Good” ratings for passenger-side small overlap crash tests. The agency, which is supported by auto insurers, has evaluated a total of 16 small SUVs and 13 midsize sedans.“When there is a passenger in a car, we believe they deserve the same level of protection in a small overlap crash as would the driver,” said Mueller. “The people who are typically sitting in that right front passenger seat are your loved ones.” GoodGoodMarginalGoodGoodPoorConsumer Reports is an independent, nonprofit organization that works side by side with consumers to create a fairer, safer, and healthier world. CR does not endorse products or services, and does not accept advertising. Copyright © 2018, Consumer Reports, Inc."
b'Huntington Beach City Council considers lawsuit against California over sanctuary law',https://www.yahoo.com/news/huntington-beach-city-council-considers-021759607.html,The Huntington Beach City Council met Monday night to decide whether or not the city should file a lawsuit against California over its sanctuary law.
b'Seth Meyers Brutally Dissects One Of Donald Trump&apos;s Weirdest Speeches Yet',https://www.yahoo.com/news/seth-meyers-brutally-dissects-one-073538698.html,"Seth Meyers couldn’t resist ridiculing President Donald Trump over his bizarre speech during the White House Easter Egg Roll.On Monday’s broadcast of “Late Night,” Meyers dissected the weirdest elements of Trump’s address, which included boasts about his supposed accomplishments and a strange struggle to describe the White House.“Now remember, this is to an audience of young children who are just there to play games with eggs,” said Meyers. “What are you talking about? I’m shocked the children didn’t start booing.” Check out the full clip above."
b'The Latest: US forces setting up positions in north Syria',https://www.yahoo.com/news/latest-russia-says-syria-evacuation-end-within-days-084746834.html,"BEIRUT (AP) — The Latest on the Syrian conflict (all times local):6:35 p.m.U.S. President Donald Trump the past week has spoken of pulling out of Syria ""very soon."" But American forces have been setting up new front-line positions outside the strategic northern town of Manbij, west of the Euphrates River.The area is the scene of a tense standoff where U.S.-backed Kurdish-led forces who hold Manbij face Turkish-backed Syrian fighters. Turkey has vowed to retake Manbij and other Kurdish-held territory along the Syrian-Turkish border; the U.S. troops stationed here are a key reason why they are holding back.The U.S.-led coalition in Syria had said there are no U.S. bases in the area and that U.S. patrols were not static. There was no immediate comment from the coalition Wednesday.___5:35 p.m.The leaders of Russia, Turkey and Iran have urged the international community to provide more aid for war-ravaged Syria.Turkish President Recep Tayyip Erdogan, Iranian President Hassan Rouhani and Russian President Vladimir Putin called for bigger humanitarian aid supplies, as well as assistance in clearing land mines and aid to help restore the destroyed infrastructure.Speaking after Wednesday's summit in Ankara, Erdogan pointed at the EU's failure to deliver 3 billion euros in assistance he said it promised for helping restore Syria's north. He added that Turkey will continue to invest its own funds in rebuilding Syria.Putin also issued a strong call on other nations to participate more actively in Syria's restauration efforts.___5:20 p.m.The leaders of Russia, Turkey and Iran say they stand against ""separatist"" agendas that would undermine Syria's sovereignty and territorial integrity.In a joint statement released at the end of their summit meeting in Ankara, Russia's Vladimir Putin, Iranian President Hassan Rouhani and Turkey's President Recep Tayyip Erdogan said Wednesday they ""rejected all attempts to create new realities on the ground under the pretext of combating terrorism.""They reaffirmed their commitment to working toward achieving cease-fires between conflicting parties in Syria and emphasized commitment to the sovereignty, independence, unity and territorial integrity of Syria.The statement said the countries reaffirmed determination to continue cooperation "" in order to ultimately eliminate"" the Islamic State group and other entities associated with al Qaida.The leaders said their next summit meeting would take place in Iran.___5:15 p.m.Iran's President Hassan Rouhani says the United States' pullout from Syria is an excuse for soliciting money from countries that want them to remain there.During a trilateral summit with Turkish and Russian Presidents, Rouhani said: ""One day they say they want to pull out of Syria ..., then it turns out that they are craving money. They have told Arab countries to give them money to remain in Syria.""___4:40 p.m.The United Nations says up to 100,000 people have returned to the Syrian city of Raqqa after a devastating air campaign by a U.S.-led coalition to drive out Islamic State group fighters.Jan Egeland of the U.N. Syria envoy's office estimated Wednesday another 100,000 are waiting outside Raqqa to return. He recounted findings of a Sunday visit by a 25-member U.N. team to Raqqa, the first of its kind since the city was freed in October.Egeland said team members described devastation ""even worse"" than in Homs and Aleppo, cities that were recaptured by Russian-backed Syrian government forces.Local leaders say 70 percent of Raqqa's buildings are destroyed or damaged and the city is riddled with unexploded bombs, grenades, and explosive traps set by IS.___3:40 p.m.Syrian state-run media says a Syrian rebel group has released five prisoners as part of a deal with the government and its Russian backers over surrendering their town in eastern Ghouta.Syrian TV says the release of the five — four women and a man — is part of ""efforts by the Syrian government to secure the release of all prisoners in Douma.""The five had been abducted by the Army of Islam rebel group in Ghouta in 2013 along with many other civilians, it said.The Britain-based Syrian Observatory for Human Rights confirmed Wednesday's release. It says the rebel group, which has been accused of abducting human rights activists and others, has several thousand prisoners.Some rebels from the group have started exiting Douma as part of the agreement.___11:45 a.m.The Russian military says it expects a rebel evacuation from the suburbs of the Syrian capital to be completed in the coming days.The Russian Defense Ministry and Syrian rebels struck a deal on Sunday for the Army of Islam, the biggest opposition group in the Damascus suburbs of eastern Ghouta, to leave the area for the rebel-controlled north.Col. Gen. Sergei Rudskoy of the Russian General Staff told a conference on Wednesday that the rebels are still leaving the town of Douma, but he expects the evacuation to wrap up in the coming days.The Defense Ministry said earlier Wednesday that more than 3,000 rebels and their family members have evacuated Douma since Sunday.The evacuation comes after a blistering five-week government offensive in February and March that killed hundreds of people and caused catastrophic damage in the besieged suburbs.___10 a.m.The leaders of Russia, Iran and Turkey are meeting in the Turkish capital for talks on Syria's future.The leaders are expected to reaffirm their commitment to Syria's territorial integrity and the continuation of local cease-fires when they meet Wednesday.The three countries have been working to try and resolve the conflict, which is now in its seventh year. Russia and Iran have provided crucial support to President Bashar Assad's forces, while Turkey has backed the rebels seeking to overthrow him.They have sponsored a series talks in the Kazakh capital, Astana, and have set up ""de-escalation zones"" aimed at reducing the fighting."
b'Fiji PM warns of &apos;frightening new era&apos; as he blames deadly cyclone on climate change',https://www.yahoo.com/news/fiji-pm-warns-apos-frightening-142646895.html," Fiji’s prime minister has blamed climate change for a cyclone which killed five people and caused severe flooding,  saying the Pacific nation is now under constant threat and has entered a “frightening new era”.As authorities tried to restore power and water supplies across various islands, Frank Bainimarama said Fiji was facing a “fight for our very survival” and urged other countries to support efforts to tackle the causes of climate change. ""We are now at an almost constant level of threat from these extreme weather events that are becoming more frequent and more severe because of climate change,"" he said.""As a nation we are starting to build our resilience in response to the frightening new era that is upon us.""Cyclone Josie brought torrential rains and led to heavy flooding on the weekend. It came just six weeks after Cyclone Gita in February, which caused some property damage in Fiji but devastated Tonga, and two years after Cyclone Winston, which killed 44 people.Fiji and other small Pacific nations have led a desperate push for global action to combat climate change, saying that rising sea levels and intense weather events have already begun to make parts of their territory uninhabitable.Mr Bainimarama assumed a leading role in international climate talks last November when he served as president of the UN's COP23 negotiation in Bonn.""We need to get the message out loud and clear to the entire world about the absolute need to confront this crisis head on,"" he said.Most scientists believe climate change will reduce the frequency of cyclones as temperature differences between the earth’s surface and the atmosphere decrease. But it will lead to more intense cyclones – including higher wind speeds and greater rainfall  - as warmer water temperatures add to overall precipitation and to the amount of energy at the water surface. Australia’s Bureau of Meteorology said it was difficult to detect trends about cyclone intensity in the region because of a lack of consistent data. But it noted: “We may have fewer cyclones but the ones we do have will be stronger.”Five places | threatened by climate changeProfessor James Renwick, an expert in atmospheric sciences at Victoria University of Wellington, told Radio New Zealand in February he expected cyclone intensity to increase because there will be “more energy in the climate system”. “Warmer seas, warmer air - so when you have a tropical cyclone it's likely to be more intense,"" he said.Since the latest cyclone in Fiji, authorities have been clearing  debris, restoring roads and assisting people who have taken shelter in dozens of evacuation centres.Ranjana Devi, a mother of two, said her family was trapped in their house as the floodwaters smashed through their village  and started rising in their home. She and her husband were in separate rooms – each with a son - and survived when their  boys kicked through a window and opened a door to allow them to escape.“At one point it was me and my younger son Veron trapped in one room,” she told the Fiji Sun.“My husband and elder son Devan were trapped in the other room. It all happened so quickly. As the water rose, we knew we could have all died and what made it worse was the fact that we were separated and locked in different rooms.”She added: “From here, we will rebuild and start all over. We have lost everything in this flood.”"
